{"categoryName":"Media","categorySlug":"media","generatedAt":"2026-03-17T00:00:00+03:00","topics":[{"id":"persistent-mini-player-dock","titleHint":"Persistent Mini Player Dock","appName":"Spotify","rationale":"Official App Store screenshots for Spotify, Apple Music, Audible, and Pocket Casts consistently surface a compact bottom player that keeps playback context visible while users browse elsewhere in the app.","targetUserValue":"Lets listeners pause, resume, and reopen full playback from anywhere without losing their place.","appStoreSearchHint":"Spotify https://apps.apple.com/us/app/id324684580 | Apple Music https://apps.apple.com/us/app/id1108187390 | Pocket Casts https://apps.apple.com/us/app/id414834813 | Audible https://apps.apple.com/us/app/id379693831","differentiator":"Unlike a generic bottom bar, this component needs playback-aware states like artwork, progress, route handoff, buffering, and offline status in a compact expandable shell.","states":["collapsed playing","collapsed paused","buffering","offline downloaded item"]},{"id":"progress-aware-media-shelf","titleHint":"Progress-Aware Media Shelf","appName":"Netflix","rationale":"Official App Store listings for Netflix, YouTube, and Apple Music repeatedly use horizontal content shelves with bold artwork, brief metadata, badges, and resume progress to make large catalogs scannable on mobile.","targetUserValue":"Helps users browse, compare, and resume shows, videos, or albums quickly from a home feed or detail page.","appStoreSearchHint":"Netflix https://apps.apple.com/us/app/id363590051 | YouTube https://apps.apple.com/us/app/id544007664 | Apple Music https://apps.apple.com/us/app/id1108187390","differentiator":"This should be more than a plain carousel: the seed should support in-progress bars, live or premium badges, mixed editorial and personalized cards, and compact secondary actions.","states":["editorial featured card","in-progress resume card","live or premiere badge","premium locked card"]}]}